{
  "$schema": "http://json-schema.org/draft-07/schema#",
  "$comment": "GENERATED by gui/schema-gen/derive_nf_config_schemas.py from config/chf.json + its source (ADR-0425). Do not edit; regenerate.",
  "title": "chf",
  "type": "object",
  "additionalProperties": false,
  "properties": {
    "port": {
      "type": "integer",
      "x-env-override": "CHF_PORT",
      "x-cpp-type": "unsigned short"
    },
    "sbi_bind_address": {
      "type": "string",
      "x-env-override": "CHF_SBI_BIND_ADDRESS",
      "x-cpp-type": "std::string"
    },
    "metrics_bind_address": {
      "type": "string",
      "x-env-override": "CHF_METRICS_BIND_ADDRESS",
      "x-cpp-type": "std::string"
    },
    "nrf_base_url": {
      "type": "string",
      "x-env-override": "CHF_NRF_BASE_URL",
      "x-cpp-type": "std::string"
    },
    "product_catalog_base_url": {
      "type": "string"
    },
    "balance_management_base_url": {
      "type": "string"
    },
    "rating_database_url": {
      "type": "string",
      "x-env-override": "CHF_RATING_DATABASE_URL",
      "x-cpp-type": "std::string",
      "x-sensitivity": "credential"
    },
    "idempotency_key_ttl_seconds": {
      "type": "integer",
      "x-env-override": "CHF_IDEMPOTENCY_KEY_TTL_SECONDS",
      "x-cpp-type": "int"
    },
    "idempotency_wait_poll_ms": {
      "type": "integer",
      "x-env-override": "CHF_IDEMPOTENCY_WAIT_POLL_MS",
      "x-cpp-type": "int"
    },
    "idempotency_wait_max_ms": {
      "type": "integer",
      "x-env-override": "CHF_IDEMPOTENCY_WAIT_MAX_MS",
      "x-cpp-type": "int"
    },
    "redis_url": {
      "type": "string",
      "x-env-override": "CHF_REDIS_URL",
      "x-cpp-type": "std::string"
    },
    "redis_mode": {
      "type": "string",
      "x-env-override": "CHF_REDIS_MODE",
      "x-cpp-type": "std::string"
    },
    "redis_pool_size": {
      "type": "integer",
      "x-env-override": "CHF_REDIS_POOL_SIZE",
      "x-cpp-type": "int"
    },
    "doris_host": {
      "type": "string",
      "x-env-override": "CHF_DORIS_HOST",
      "x-cpp-type": "std::string"
    },
    "doris_port": {
      "type": "integer",
      "x-env-override": "CHF_DORIS_PORT",
      "x-cpp-type": "std::uint16_t"
    },
    "doris_user": {
      "type": "string",
      "x-env-override": "CHF_DORIS_USER",
      "x-cpp-type": "std::string"
    },
    "doris_password": {
      "type": "string",
      "x-env-override": "CHF_DORIS_PASSWORD",
      "x-cpp-type": "std::string",
      "x-sensitivity": "credential"
    },
    "doris_database": {
      "type": "string",
      "x-env-override": "CHF_DORIS_DATABASE",
      "x-cpp-type": "std::string"
    },
    "cdr_event_bus_brokers": {
      "type": "string",
      "x-env-override": "CHF_CDR_EVENT_BUS_BROKERS",
      "x-cpp-type": "std::string"
    },
    "cdr_event_bus_topic": {
      "type": "string",
      "x-env-override": "CHF_CDR_EVENT_BUS_TOPIC",
      "x-cpp-type": "std::string"
    },
    "cdr_direct_insert": {
      "type": "boolean",
      "x-env-override": "CHF_CDR_DIRECT_INSERT",
      "x-cpp-type": "bool"
    },
    "cdr_event_bus_flush_timeout_ms": {
      "type": "integer",
      "x-env-override": "CHF_CDR_EVENT_BUS_FLUSH_TIMEOUT_MS",
      "x-cpp-type": "int"
    },
    "ai_quota_sizing_enabled": {
      "type": "boolean",
      "x-env-override": "CHF_AI_QUOTA_SIZING_ENABLED",
      "x-cpp-type": "bool"
    },
    "quota_model_path": {
      "type": "string",
      "x-env-override": "CHF_QUOTA_MODEL_PATH",
      "x-cpp-type": "std::string"
    },
    "ai_quota_latency_budget_us": {
      "type": "integer",
      "x-env-override": "CHF_AI_QUOTA_LATENCY_BUDGET_US",
      "x-cpp-type": "std::int64_t"
    },
    "diameter_port": {
      "type": "integer",
      "x-env-override": "CHF_DIAMETER_PORT",
      "x-cpp-type": "unsigned short"
    },
    "cap_port": {
      "type": "integer",
      "x-env-override": "CHF_CAP_PORT",
      "x-cpp-type": "unsigned short"
    },
    "rating_db_pool_size": {
      "type": "integer",
      "x-env-override": "CHF_RATING_DB_POOL_SIZE",
      "x-cpp-type": "int"
    },
    "catalog_snapshot_refresh_interval_seconds": {
      "type": "integer",
      "x-env-override": "CHF_CATALOG_SNAPSHOT_REFRESH_INTERVAL_SECONDS",
      "x-cpp-type": "std::int64_t"
    },
    "li_poi": {
      "type": "object",
      "additionalProperties": false,
      "properties": {
        "enabled": {
          "type": "boolean"
        },
        "x1_bind_address": {
          "type": "string"
        },
        "x1_port": {
          "type": "integer"
        },
        "ne_identifier": {
          "type": "string"
        },
        "network_function_id": {
          "type": "string"
        },
        "interception_point_id": {
          "type": "string"
        },
        "mdf2_host": {
          "type": "string"
        },
        "mdf2_port": {
          "type": "integer"
        },
        "mdf2_sni": {
          "type": "string"
        },
        "x1_keepalive_p1_seconds": {
          "type": "integer"
        },
        "x1_keepalive_p2_seconds": {
          "type": "integer"
        },
        "x1_keepalive_p3_seconds": {
          "type": "integer"
        },
        "x1_allow_deactivate_all": {
          "type": "boolean"
        }
      }
    },
    "oauth2_required": {
      "type": "boolean",
      "x-env-override": "CHF_OAUTH2_REQUIRED",
      "x-cpp-type": "bool"
    }
  },
  "required": [
    "ai_quota_latency_budget_us",
    "ai_quota_sizing_enabled",
    "cap_port",
    "cdr_event_bus_flush_timeout_ms",
    "diameter_port",
    "doris_database",
    "doris_host",
    "doris_password",
    "doris_port",
    "doris_user",
    "idempotency_key_ttl_seconds",
    "idempotency_wait_max_ms",
    "idempotency_wait_poll_ms",
    "metrics_bind_address",
    "nrf_base_url",
    "port",
    "quota_model_path",
    "rating_database_url",
    "rating_db_pool_size",
    "redis_url",
    "sbi_bind_address"
  ],
  "x-config-file": "config/chf.json",
  "x-source": [
    "nfs/chf"
  ],
  "x-apply": "restart",
  "x-review": [
    "product_catalog_base_url: present in the file but no source line visibly reads it",
    "balance_management_base_url: present in the file but no source line visibly reads it",
    "li_poi: nested object shape inferred from current values (map-vs-struct meaning unverified; new keys refused until reviewed)"
  ]
}
