{
  "port": 7784,
  "sbi_bind_address": "0.0.0.0",
  "metrics_bind_address": "0.0.0.0:9472",
  "nrf_base_url": "https://127.0.0.1:7777",
  "product_catalog_base_url": "https://127.0.0.1:7785",
  "balance_management_base_url": "https://127.0.0.1:7786",
  "rating_database_url": "postgresql://postgres@127.0.0.1:5434/charging",
  "idempotency_key_ttl_seconds": 3600,
  "idempotency_wait_poll_ms": 20,
  "idempotency_wait_max_ms": 2000,
  "redis_url": "tcp://127.0.0.1:6379",
  "redis_mode": "single",
  "redis_pool_size": 8,
  "doris_host": "127.0.0.1",
  "doris_port": 9030,
  "doris_user": "root",
  "doris_password": "",
  "doris_database": "chf_cdr",
  "cdr_event_bus_brokers": "",
  "cdr_event_bus_topic": "chf.cdr",
  "cdr_direct_insert": true,
  "cdr_event_bus_flush_timeout_ms": 10000,
  "ai_quota_sizing_enabled": false,
  "quota_model_path": "",
  "ai_quota_latency_budget_us": 50000,
  "diameter_port": 3868,
  "cap_port": 2905,
  "rating_db_pool_size": 8,
  "catalog_snapshot_refresh_interval_seconds": 30,
  "li_poi": {
    "enabled": false,
    "x1_bind_address": "0.0.0.0",
    "x1_port": 7816,
    "ne_identifier": "chf-poi-01",
    "network_function_id": "chf-01.5gc.example.net",
    "interception_point_id": "CHF-IRI-POI-1",
    "mdf2_host": "127.0.0.1",
    "mdf2_port": 7806,
    "mdf2_sni": "localhost",
    "x1_keepalive_p1_seconds": 60,
    "x1_keepalive_p2_seconds": 180,
    "x1_keepalive_p3_seconds": 300,
    "x1_allow_deactivate_all": true
  },
  "oauth2_required": true
}
